Name,Date,Author,Link,Tag1,Tag2,Tag3,Tag4,Tag5,Tag6,Tag7
Tailored access management for Dynatrace: Part 1 – One configuration for all authorization requirements,"October 26, 2022",Florian Aigner,https://www.dynatrace.com/news/blog/tailored-access-management-for-dynatrace-part-1-one-configuration-for-all-authorization-requirements/,access-management,dynatrace-version-1-252,environment-permissions,security-policies
Why open source software and open standards are crucial to the future of software development,"October 26, 2022",Jane Mulcaster,https://www.dynatrace.com/news/blog/why-open-source-software-and-open-standards-are-is-crucial-to-the-future-of-software-development/,observability,open-source,open-standards,opentelemetry
Dynatrace SaaS release notes version 1.253,"October 25, 2022",Ilya Gutin,https://www.dynatrace.com/news/blog/dynatrace-saas-release-notes-version-1-253/
Prevent potential problems quickly and efficiently with Davis exploratory analysis,"October 25, 2022",Mario Mauracher,https://www.dynatrace.com/news/blog/davis-ai-exploratory-analysis/,davis-ai,exploratory-analysis,featured
Path to NoOps part 1: How modern AIOps brings NoOps within reach,"October 25, 2022",Ram Vasu,https://www.dynatrace.com/news/blog/modern-aiops-brings-noops-within-reach/,aiops,autonomous-cloud,noops
How OpenFeature — and feature flag standardization —enables high-quality continuous software delivery,"October 24, 2022",Michael Beemer,https://www.dynatrace.com/news/blog/openfeature-and-feature-flag-standardization/,cloud-automation,cncf,featured,openfeature
"New high severity vulnerability, CVE-2022-42889, in Apache Commons Text discovered","October 18, 2022",Robin Wyss,https://www.dynatrace.com/news/blog/new-critical-vulnerability-cve-2022-42889-in-apache-commons-text-discovered-but-no-need-to-panic/,apache,apache-commons-text-vulnerability,security-vulnerability
